eng,hindi
I haven't seen him for a long time.,मैंने उसे बहुत दिनों से नहीं देखा है।
He promised me that he would be more careful in the future.,उसने मुझसे वादा किया था कि वह आगे से ज़्यादा सावधान रहेगा।
This book is very thin.,यह किताब बहुत पतली है।
Are you at home?,तुम घर पे हो क्या?
The top of that mountain is flat.,उस पहाड़ की चोटी चपटी है।
Tom was stabbed to death last night.,कल रात टॉम की चाकू मारकर हत्या कर दी गई थी।
When are you going to Europe?,तुम यूरोप कब जा रहे हो?
I have caught a cold.,मुझे ज़ुकाम हो गया है।
These are very old books.,ये किताबें काफ़ी पुरानी हैं।
Could you speak more slowly?,थोड़ा धीरे बोल सकते हैं क्या?
I wouldn't do that to anybody.,मैं ऐसा किसी के साथ नहीं करुंगा।
That town is two miles away.,वह नगर दो मील दूर है।
I'll be on duty this Sunday.,मैं इस रविवार को ड्यूटी पर हूँगा।
The car broke down on the way to the airport.,एयरपोर्ट के रास्ते पर गाड़ी खराब हो गई।
She began to sing.,वह गाने लगी।
I'm going to go buy some materials today.,मैं आज कुछ सामान ख़रीदने जाऊँगी।
He walked along the river.,हमने नदी के किनारे सैर करी।
We must try to protect the environment.,हमे पर्यावरण की रक्षा करने की कोशिश करनी चाहिए।
I chose to leave instead of staying behind.,मैंने रहने की बजाय जाने का इरादा किया।
Nice to meet you.,आपसे मिलकर खुशी हुई।
This must be a real diamond.,यह असली हीरा होगा।
She asked us to be quiet.,उसने हमें चुप रहने के लिए कहा।
Could you bring me another hot towel?,मेरे लिए एक और गरम तौलिया ला सकते हैं क्या?
Please close the door.,दरवाज़े को बंद कर दीजिए।
He deliberately ignored me when I passed him in the street.,"जब मैं सड़क पर उसके सामने से गया, उसने जानबूझकर मुझे पहचाना नहीं।"
Butter and cheese are made from milk.,मक्खन और पनीर दूध से बनते हैं।
They hated each other.,वे एक-दूसरे से नफ़रत करते थे।
It has been raining for three days on end.,लगातार तीन दिनों से बारिश हो रही है।
I've been given until tomorrow to finish this.,मुझे ये कल तक खतम करना है ।
We were surprised at the news.,हम खबर सुनकर चौंक गए।
We're in a hurry.,हम जल्दी में हैं।
Don't worry. You can count on me.,चिंता मत करो। तुम मुझपर भरोसा कर सकते हो।
This is what I found in the cave.,मुझे गुफ़ा में ये मिला।
Are there enough chairs?,कुरसियाँ काफ़ी हैं क्या?
They continued eating as if nothing had happened.,वे ऐसे खाते रहे जैसे कुछ हुआ ही न हो।
Your feet are swollen because your shoes are too small.,तुम्हारे पैर सूज गए हैं क्योंकि तुम्हारे जूते बहुत छोटे हैं।
Do you want to go somewhere?,तुम्हें कहीं जाना है?
"In those days, I went to bed earlier.",उन दिनों में मैं (रात में) जल्दी से सो जाया करता था।
"In case I can't come, I'll give you a call beforehand.",अगर मैं नहीं आ पाया तो तुम्हें पहले फ़ोन करके बतादूँगा।
He betrayed his country.,उसने अपने देश को धोखा दे दिया।
Turn your face this way.,अपना मूँह इस ओर मोड़ो।
I went there dozens of times.,मैं वहाँ दसियों बार जा चुका हूँ।
Are you a doctor?,आप डॉक्टर हैं क्या?
She was very surprised at the news.,वह खबर सुनकर हैरान रह गई।
Don't fail to call me back.,मुझे वापस फ़ोन करना मत भूलना।
"At last, the truth became known to us.",आखिरकार हमे सच्चाई का पता चल गया।
My sister is very fond of children.,मेरी बहन को बच्चों से बहुत प्यार है।
I'm very thirsty.,मुझे बहुत प्यास लगी है।
He took advantage of every opportunity he had.,उसने किसी भी मौके को हाथ से जाने नहीं दिया।
What do you usually do after dinner?,तुम आमतौर पर रात में खाना खाने के बाद क्या करते हो?
I'm alone.,मैं अकेला हूँ ।
Could you please speak a little bit more slowly?,आप थोड़ा धीरे बोल सकते हैं क्या?
I think there has been some misunderstanding here.,मुझे लगता है कि यहाँ कुछ ग़लतफ़ैमी हुई है।
Tom wants to do that alone.,टॉम अकेले वैसा करना चाहता है।
I received a letter which was written by her.,मुझा उसकी लिखी हुई एक चिट्ठी मिली।
He is after a job.,वह किसी नौकरी के पीछे पड़ा है।
I'll be back by nine.,मैं नौ बजे से पहले वापस आ जाऊँगा।
Try it once again.,एक बार फिरसे कोशिश करो।
He was respected both as a teacher and as a man.,उसको दोनो एक अध्यापक और एक इनसान के रूप में सम्मान मिला।
You must study hard.,तुम्हें मन लगाकर पढ़ना होगा।
He breathed deeply.,उसने गहरी साँस ली।
Everyone knew the song.,वह गाना सभी को पता था।
Have you ever failed an exam?,क्या आप कभी किसी परीक्षा में असफल हुए हैं?
We must not speak ill of others behind their backs.,हमे लोगों की पीठ के पीछे उनकी बुराई नहीं करनी चाहिए।
He has a beard.,उसके पास दाढ़ी है।
I really like city life.,मुझे शहर की ज़िन्दगी पसंद है।
It is not till we lose our health that we realize its true value.,"हम जब तक अपनी सेहत नहीं खो देते हैं, हमे तब तक उसकी असली कीमत नहीं पहचानते हैं।"
He has a little money.,उसके पास थोड़े-बहुत पैसे हैं।
It seems to me that you're wrong.,मुझे लगता है कि तुम ग़लत हो।
The fat woman was holding a monkey.,उस मोटी औरत ने एक बंदर पकड़ा हुआ था।
Why have you shut the door?,तुमने दरवाज़ा क्यों बंद कर दिया ?
"Frankly speaking, I don't want to work with him.",खुलकर बोलूँ तो मैं उसके साथ काम नहीं करना चाहता।
What would you like to do while you're here in Australia?,जब आप यहां ऑस्ट्रेलिया में हो तो आप क्या करना चाहेंगे?
What is the difference between imitation and real diamonds?,असली और नकली हीरों में क्या फ़र्क होता है?
The house is haunted.,इस घर में भूत है।
I do what I'm told.,मैं वही करती हूं जो मुझे बताया जाता है।
Why don't you listen to me?,तुम मेरी बात सुनते क्यों नहीं हो?
She said that she was happy.,उसने कहा कि वह खुश थी।
They abandoned the sinking ship.,वे डूबते हुए जहाज़ से निकल गए।
You shouldn't leave the baby alone.,तुम्हें बच्चे को अकेला नहीं छोड़ना चाहिए।
A selfish man thinks of nothing but his own feelings.,मतलबी इनसान केवल अपने बारे में ही सोचता है।
I want to go to America some day.,मैं एक दिन अमेरिका जाना चाहता हूँ।
It is difficult for me to get up before six.,मेरे लिए छः बजे से पहले उठना बहुत मुश्किल है।
I am eating an apple.,मैं सेव खा रही हूँ ।
"Instead of laying off these workers, why don't we just cut their hours?",इन कर्मचारियों को नौकरी से निकालने की बजाय क्यों न हम इनके काम करना का समय कम करदें?
I like math.,मुझे गणित पसंद है।
Tell me what you are looking forward to.,मुझे बताओ तुम किस चीज़ की आशा कर रहे हो।
We went for a walk in the forest.,हम जंगल में सैर करने गए थे।
They were scattered in all directions.,वे सारी दिशाओं में फैले हुए थे।
I can't put up with this noise anymore.,मैं इस शोर को और बर्दाश्त नहीं कर सकती।
How are you?,आप कैसे हैं?
I had a fight with my older brother yesterday.,मेरा कल मेरे भाई के साथ झगड़ा हुआ था।
English is the world's language.,अंग्रेज़ी सारी दुनिया की भाषा है।
Perfect!,सही!
You look nice in that dress.,तुम उस ड्रेस में अच्छी लगती हो।
That's no business of yours.,इसका तुमसे कोई लेना-देना नहीं है।
I can drive a car.,मैं गाड़ी चला सकता हूँ।
There must be another way.,कोई और रास्ता भी होगा।
"You're tired, aren't you?","तुम थक गए हो, है ना?"
Where should I pick the tickets up?,मुझे टिकटें कहाँ से लेनीं होंगीं?
I hope that it rains tomorrow.,काश कल बारिश हो जाए।
I couldn't make out what he wanted to say.,मैं समझ नहीं पा रहा था कि वह कहना क्या चाहता था।
I made the woman angry.,मैंने उस औरत को गस्सा दिलाया।
Has Tom left?,टॉम चला गया क्या?
People of your age often have this problem.,तुम्हारी उम्र के लोगों को अक्सर इस तरह की दिक्कत होती है।
"Turn off the light, please.","बत्ती बंद करदो, प्लीज़।"
How's your job going?,तुम्हारी नौकरी कैसी चल रही है?
Go and play with your friends.,जाओ और अपने दोस्तों के साथ खेलो।
What would you like for supper?,आप रात में खाने के लिए क्या खाना चाहेंगे?
Tom told me he didn't get enough sleep.,टॉम ने मुझे बताया कि उसे पर्याप्त नींद नहीं मिली।
Please don't look at your mobile phone while we're eating.,भोजन करते समय कृपया अपने मोबाइल फ़ोन को ना देखें।
The situation calls for drastic measures.,इस परिस्थिति में कठोर कदम उठाने होंगे।
He stood up.,वह खड़ा हो गया।
Clean the room.,कमरे को साफ़ करो।
Electric power companies are seeking to reduce their use of coal.,बिजली कम्पनियाँ कोयले का इस्तेमाल कम करने की कोशिश कर रही हैं।
I'm too tired to walk.,मैं इतना थक गया हूँ कि मुझसे और चला नहीं जाएगा।
I helped my mother wash the dishes.,मैंने अपनी मम्मी को बर्तन धोने में मदद करी।
She loves watching tennis matches on TV.,उसे टीवी पर टेनिस देखना बहुत पसंद है।
You must take his age into account.,तुम्हें उसकी उम्र का भी लिहाज़ करना चाहिए।
Who doesn't know such a simple proverb?,इस तरह की आम कहावत को कौन नहीं जानता?
Answer my questions.,मेरे सवालों का जवाब दो।
I don't know what Tom would like me to do.,मुझे नहीं पता कि टॉम मुझ से क्या करवाना चाहता है।
He made such a long speech that we all got bored.,उसने इतना लम्बा भाषण दिया कि हम सब को बोर कर डाला।
I know a girl who can ride a unicycle.,मेरे जान-पहचान की एक लड़की को युनिसायकल चलाना आता है।
How long have you been abroad?,आप विदेश में किता समय रहे हैं?
Do you watch television?,आप टीवी देखतें हैं क्या?
I like donuts.,मुझे डॉनत पसंद है।
Tom and Mary want to know what our plan is.,टॉम और मेरी हमारा प्लैन जानना चाहते हैं।
May I come in?,मैं अंदर आ सकता हूँ क्या?
Were you shot?,क्या तुम्हें गोली लग गई थी?
I am at home.,मैं घर पर हूँ।
Try to jump as high as possible.,जितना ऊँचा कूद सकते हो कूदो।
We were next-door neighbors.,हम पड़ोसी हुआ करते थे।
I gave him what money I had.,मेरे पास जो भी पैसे थे मैंने उसे दे दिए।
Would you please explain the rules to me?,आप मुझे नियम समझा सकते हैं क्या?
Fat hens lay few eggs.,मोटी मुर्गियाँ कम अंडे देतीं हैं।
I don't know what Tom would like me to do.,मुझे नहीं पता कि टॉम मुझ से क्या करवाना चाहते हैं।
Cheese is made from milk.,चीज़ दूध से बनता है।
She has a rich vocabulary of English words.,उसको बहुत सारे अंग्रेज़ी शब्द आते हैं।
I don't think I can wait that long.,मैं उतनी देर रुक नहीं सकता।
It's not healthy for you.,यह तुम्हारी सेहत के लिए अच्छा नहीं है।
Unbelievable!,अविश्वसनीय!
"The instant he opened the door, he smelt something burning.",उसे दरवाज़ा खोलते ही किसी चीज़ के जलने की बदबू सुँघाई दी।
There is no TV in my room.,मेरे कमरे में टीवी नहीं है।
We have some new products we'd like you to see.,आपको कुछ नए प्रॉडक्ट्स दिखाना चाहते हैं।
Is your father a teacher?,तेरा बाप टीचर है क्या?
I take a bath every other day.,मैं हर दूसरे दिन नहाता हूँ।
"When you leave the room, please make sure you turn off the lights.","कमरे से निकलने से पहले, कृपया बत्तियाँ बंद कर दीजिएगा।"
I'll stay home.,मैं घर पर ही रहूँगा।
Do you have any tickets left?,तुम्हारे पास टिकटें बचीं हैं क्या?
Tom is able to swim well.,टॉम को अच्छे से तैरना आता है।
She told me that she wanted a pet dog.,उसने मुझसे कहा कि उसे कुत्ता पालने का मन था।
We may not win tomorrow.,हम कल शायद नहीं जीतेंगे।
"Without a dictionary, it would be hard to study English.",शब्दकोश (डिक्शनरी) के बिना अंग्रेज़ी की पढ़ाई करना बहुत मुश्किल होगा।
A squirrel hid among the branches.,एक गिलहरी डालियों के बीच छुपी हुई थी।
Where is the problem?,मुश्किल कहाँ है?
I will give you a call as soon as I get home.,मैं घर पहुँचते ही तुम्हें फ़ोन करूँगी।
The boy gathered a handful of peanuts and put them in a small box.,उस लड़के ने एक मुट्ठीभर मूँगफलियाँ लीं और उन्हें एक छोटे से डब्बे में डाल दिया।
A committee has been set up to investigate the problem.,इस समस्या की तहकीकात करने के लिए एक समिति स्थापित करी गई है।
The medicine tastes bitter.,इस दवाई का स्वाद बहुत कड़वा है।
He was walking toward the sea.,वह समुंदर की ओर चल रहा था।
He closed his eyes.,उसने अपनी आँखें बंद करीं।
Come along with us.,हमारे साथ आओ।
May I talk with you in private about the matter?,मैं तुम्हारे साथ इस बारे में अकेले में बात कर सकता हूँ क्या?
"Believe it or not, that's true.","मानो या न मानो, यह तो सच है।"
I go to school on foot.,मैं स्कूल चल कर जाती हूँ।
The water was cut off yesterday.,पानी कल बंद हो गया था।
Cheers!,चियर्स!
The cat slowly approached the mouse.,बिल्ली धीरे से चूहे की तरफ़ बढ़ी।
I'm tired of watching television.,मैं टीवी देख देखकर थक गया हूँ।
"If Tom doesn't help us, we'll never be able to finish this on time.",अगर टॉम हमारी मदद नहीं करेगा तो हम ये समय पर कभी नहीं कर पायेंगे।
Don't make me slap you.,मुझे तुम्हें थप्पड़ करने के लिए मजबूर मत करो।
The monkey climbed up a tree.,बंदर पेड़ पर चढ़ा।
You must be back by 10 o'clock.,तुम्हें दस बजे तक वापस आ जाना होगा।
What type of job are you looking for?,आप किस प्रकार की नौकरी ढूंढ रहे हैं ।
She dialed the wrong number.,उसने गलत नम्बर मिला डाला।
Where do you live?,तुम कहाँ रहते हो?
I'll wait here until my medicine is ready.,जब तक मेरी दवाई तैयार नहीं होती मैं यहीं इंतेज़ार करूंगी।
You made me lose my mind.,तुमने मुझे पागल कर दिया।
I know your father.,मैं तुम्हारे पिताजी को जानता हूँ।
I can read English.,मैं अंग्रेज़ी पढ़ सकता हूँ।
My father died of cancer.,मेरे पिताजी कैंसर से चल बसे।
I bet ten dollars on that horse.,मैंने उस घोड़े पर दस डॉलर लगाए थे।
What is happiness?,सुख क्या होता है?
I want to help you with your homework.,मैं तुम्हें तुम्हारे होमवर्क के साथ मदद करना चाहता हूँ।
Have you ever failed an exam?,क्या आप कभी किसी परीक्षा में असफल हुई हैं?
It was really boring.,यह बहुत उबाऊ था।
We are anxious for world peace.,हम विश्व शांति के लिए तत्पर हैं।
These trees were planted by them.,ये पेड़ उन्होंने लगाए थे।
He understands physics.,वह भौतिक विज्ञान समझता है।
May we accompany you on your walk?,हम तुम्हारे साथ सैर करने चलें क्या?
I'm fine.,मैं ठीक हूँ।
"When you can't do what you want, you do what you can.","जब वह नहीं कर सकते जो करना चाह्ते हो, तो वह करो जो कर सकते हो।"
I want to say thank you to Tom.,मैं टॉम को धन्यवाद कहना चाहता हूं।
This house has eleven rooms.,इस मकान में ग्यारह कमरे हैं।
He'll get well soon.,वह जल्द ही ठीक हो जाएगा।
He did not die of cancer.,वह कैंसर से नहीं मरा।
My father stopped smoking.,मेरे पिता ने सिगरेट पीना बंद कर दिया।
He put a hand gently on her shoulder.,उसने हल्के से उसके कंधे पर हाथ रखा।
What about us?,हमारा क्या?
She always wears black.,वह हमेशा काले कपड़े पहनती है।
I don't like studying in this heat.,मुझे इस गर्मी में पढ़ाई करना अच्छा नहीं लगता।
These are birds.,ये चिड़ियाँ हैं।
"She had plenty of acquaintances, but no friends.",उसकी जान-पहचान में तो बहुत लोग थे पर दोस्त कोई भी नहीं थे।
"If I don't do it now, I never will.",अगर मैं अभी नहीं करूँगा तो कभी नहीं करूँगा।
When did America become independent of England?,अम्रीका को इंग्लैंड से आज़ादी कब मिली?
My stomach is growling.,मेरा पेट गुड़गुड़ा रहा है।
Please leave.,कृपया जाईये।
He usually comes home late.,वह आमतौर पर घर देर से आता है।
Do you know Tom personally?,क्या आप व्यक्तिगत रूप से टॉम को जानते हैं?
Where would you like to sit?,आप कहाँ बैठना चाहेंगे?
Everyone likes her.,उसे सब पसंद करते हैं।
"In the woods, she met with two strangers.",वह जंगल में दो अजनबियों से मिली।
Do you have an appointment?,आपके पास अपौइंटमेंट है क्या?
