eng,hindi
He wiped the sweat from his forehead.,उसने अपने माथे से पसीना पोंछा।
I asked him to do that.,मैंने उससे वह करने को कहा था।
Thousands of foreigners visit Japan every year.,हज़ारों विदेशी हर साल जापान जाते हैं।
The man who is standing there is my father.,वहाँ पर खड़े हुए वे मेरे पिता हैं।
I've quit drinking beer.,मैंने बीयर पीना छोड़ दिया है।
She wore a red dress.,उसने लाल रंग के कपड़े पहने थे।
That's really a great idea.,यह तो बहुत ही अच्छा सुझाव है।
He isn't my cousin.,वह मेरा चचेरा भाई नहीं है।
What are you looking for?,क्या ढूँढ रहे हो?
He prefers French to German.,उसे फ़्रानसीसी जर्मन से ज़्यादा अच्छी लगती है।
Wonderful!,अद्भुत
Have your roses come out yet?,तुम्हारे गुलाब खिल गए हैं क्या?
Parents are responsible for the safety of their children.,मातापिता अपने बच्चों की हिफ़ाज़त के लिए ज़िम्मेदार होते हैं।
She is not afraid of anything.,उसे किसी भी चीज़ का डर नहीं है।
Soldiers are used to danger.,सिपाहियों को खतरे से खेलने की आदत होती है।
He saw a dog near the door.,उसने दरवाज़े के पास एक कुत्ता देखा।
I've got a bit of an ache in my back.,मेरी पीठ में थोड़ा दर्द हो रहा है।
What do you want to do in the afternoon?,तुम्हें दोपहर में क्या करने का मन है?
It was proved that he was a thief.,यह साबित कर दिया गया कि वह चोर था।
"I've never met him, but I recognize him.",मैं उसे पहचानता हूँ पर मैं उससे कभी मिला नहीं हूँ।
It has been fine since last Friday.,पिछले शुक्रवार से मौसम बहुत अच्छा है।
You're a life saver.,तुमने मेरी जान बचाली।
Tom may invite us.,टॉम हमें आमंत्रित कर सकता है।
The skies are clear.,आसमान साफ़ है।
"When he arrives in Tokyo, I'll call you right away.",उसके टोक्यो आते ही मैं तुम्हें तुरंत फ़ोन करूँगी।
Where's the changing room?,कपड़े बदलने का कमरा कहाँ पर है?
He gave his children a good education.,उसने अपने बच्चों को अच्छी शिक्षा दी।
I'll see you later.,फिर मिलेंगे।
Columbus argued that he could reach India by going west.,कोलम्बस ने सोचा कि वह पश्चिम दिशा में जाकर भारत पहुँच सकता था।
You might as well read a novel instead of staring at the ceiling.,छत पर घूरने के बजाए उपन्यास ही पढ़लो।
When do you play tennis?,तुम टेनिस कब खेलना चाहते हो?
Definitely!,निश्चित ही
Mother bought me the book.,मम्मी ने मेरे लिए वह किताब खरीदी।
Let me handle this.,यह मुझे संभालने दो।
The history class starts at nine.,इतिहास की क्लास नौ बजे शुरू होती है।
Glass is made from sand.,ग्लास रेत से बनाया जाता है।
She reproached me for being lazy.,उसने मुझपर आलसी होने के लिए गुस्सा किया।
He looks very tired.,वह बहुत थका-हारा सा लगता है।
I've lost my glasses.,मेरा चश्मा खो गया है।
Don't touch it.,उसे छूना मत।
Let's go and see as many things as we can.,"चलो चलें, जितनी सारी चीज़ें देख सकते हैं देख आएँ।"
I'll call you back later.,मैं आपको थोड़ी देर बाद फ़ोन करूँगा।
I know that Tom is an electrical engineer.,मुझे पता है कि टॉम एक इलेक्ट्रिकल इंजीनियर है।
I doubt his ability to do the job.,मुझे उसके काम करने की योग्यता पर भरोसा नहीं है।
We managed to swim across the river.,हम नदी को तैरकर पार कर पाए।
His new book is going to come out next month.,उसकी नई किताब अगले महीने छपेगी।
He climbed the stairs.,वह सीड़ियों पर चढ़ गया।
Do you believe me?,क्या तुम मेरा यकीन करते हो?
That's a completely unfounded rumor.,वह अफ़वाह पूरी तरह से बेबुनयाद है।
I wish I had this problem.,काश ये समस्या मुझे हुई होती।
Well done!,शाबाश!
This is the very book that I wanted to read.,यह वही किताब है जिसे मैं पढ़ना चाह्ता था।
What the newspapers say is true.,जो अखबार में लिखा है वह सच है।
Boys will be boys.,लड़के तो लड़के ही रहेंगे।
We have two unused rooms in our house.,हमारे पास घर में दो कमरे हैं जिनका हम इस्तेमाल नहीं कर रहे हैं।
He was arrested because he stole the money.,उसे पैसे चुराने के लिए गिरफ़्तार कर लिया गया।
Will you go to the party tonight?,तुम आज रात पार्टी में जाओगे क्या?
What do you want to see?,तुम क्या देखना चाहते हो?
Physics is my favorite subject.,भौतिक विज्ञान मेरा सबसे पसंदीता विषय है।
He is very fond of music.,वह संगीत का बहुत शौकीन है।
I have to learn many words and phrases by heart.,मुझे बहुत सारे शब्दों और वाक्यांशों को रटना है।
The government started a program to promote industry.,सरकार ने उद्योग बढ़ाने के लिए कार्यक्रम शुरू किया।
This elevator does not go above the sixth floor.,यह लिफ़्ट छटी मंज़िल तक ही जाती है।
I was in bed all day long yesterday.,कल मैं पूरे दिन बिस्तर में था।
It is free of charge.,यह मुफ़्त का है।
He asked me if I could do him a favor.,उसने मुझसे एक एहसान माँगा।
This car has been used for the past ten years.,इस गाड़ी का पिछले दस साल से इस्तेमाल हो रहा है।
I have a lot of work to get through today.,मेरे पास आज बहुत काम है।
I will find out how the medicine works.,मैं पता लगाऊँगा कि यह दिवाई कैसे काम करती है।
My uncle is an amateur cricket player.,मेरे मामा क्रिकेट के शौकिया खिलाड़ी हैं।
She had a daughter by her first husband.,उसकी अपने पहले पति से एक लड़की थी।
The earth moves around the sun.,धरती सूरज की परिक्रमा करती है।
I am not from India.,मैं भारत से नहीं हूँ।
I had a letter from her yesterday.,मेरे पास कल उसकी एक चिट्ठी आई।
I'm going to tell you something.,मैं तुम्हें कुछ बताने वाला हूँ।
I'd rather not meet him.,हो सके तो मैं उससे मिलना नहीं चाहूँगा।
I didn't know what to say to him.,मुझे समझ में नहीं आ रहा था कि उससे क्या कहूँ।
Let me give you a piece of advice.,मैं तुम्हें एक बात की सलाह देता हूँ।
Where is the elevator?,लिफ़्ट कहाँ पर है?
You're not supposed to play baseball here.,यहाँ बेसबॉल खेलना मना है।
Do you want to go somewhere?,आपको कहीं जाना है?
She has invited me to attend her wedding.,उसने मुझे अपनी शादी में आने का का न्योता दिया है।
This is the house where I lived when I was a child.,यह वह घर है जिसमें मैं रहता था जब मैं छोटा था।
I'm standing in the shade.,मैं छाया में खड़ा हूँ।
They stood face to face.,वे आमने-सामने खड़े हुए।
He kept us waiting for a long time.,उसने हमसे बहुत देर तक इंतेज़ार करवाया।
Let me introduce my wife.,यह मेरी पत्नी है।
Have you ever seen a koala?,तुमने कभी क्वाला देखा है?
She has a gentle heart.,वह नर्म दिल वाली है।
She cried out the moment she saw her mother.,"उसने जैसे ही अपनी मम्मी को देखा, वह चिल्ला उठी।"
School begins in April.,स्कूल अप्रैल में शुरू होता है।
Can I extend my stay one more night?,मैं एक रात और रह सकता हूँ क्या?
That was my fault.,वह मेरी ग़लती थी।
English is the world's language.,अंग्रेज़ी वैश्विक भाषा है।
Don't leave the door open.,दरवाज़े को खुला मत छोड़ो।
Get out!,बाहर निकल जाओ!
I wanted Tom to study harder.,मैं चाहता था कि टॉम ज़्यादा पढ़ाई करे।
May I go ahead of you?,क्या मैं आपसे आगे चला जाऊं?
How do you feel today?,तुम्हें आज कैसा लग रहा है?
The box is made of wood.,डब्बा लकड़ी का बना है।
It was Tom that broke the window yesterday.,कल जिसने खिड़की तोड़ी थी वह टॉम था।
"I know her by sight, but I've never spoken to her.",मैं उसे पहचानता हूँ पर मैंने उससे कभी बात नहीं करी है।
"Although they are twins, they have few interests in common.","वे हालांकि जुड़वा हैं, उनके शोक एक-दूसरे से बहुत अलग हैं।"
Excuse me.,माफ़ कीजिए।
We don't know where we are.,हमें नहीं पता हम कहाँ हैं।
Do you need an ambulance?,आपको ऐमब्यूलेंस की ज़रूरत है क्या?
Do you have any brothers?,तुम्हारे कोई भाई हैं क्या?
We're against war.,हम जंग के ख़िलाफ़ हैं।
It seems interesting to me.,मुझे बहुत दिलचस्प लगती है!
You reap what you sow.,जैसा करना वैसा भरना।
He's my husband.,यह मेरा पति है।
I feel like taking a rest.,मुझे थोड़ा आराम करने का मन है।
Do you go there by bus or by car?,तुम वहाँ बस से जाते हो या गाड़ी से?
The thief is certain to be caught eventually.,चोर अंत में तो पकड़ा ही जाएगा।
He eats lunch at a cafeteria.,वह कैनटीन में लन्च खाता है।
What time does your watch say it is now?,तुम्हारी घड़ी अब क्या समय बता रही है?
Do you know this part of the city very well?,तुम शहर के इस हिस्से को अच्छी तरह से जानते हो क्या?
He broke one of the bones in his leg.,उसने अपने पैर की एक हड्डी तोड़ ली।
The job must be finished by 3 p.m.,यह काम दोपहर तीन बजे से पहले खतम हो जाना चाहिए।
I do what I'm told.,मैं वही करता हूं जो मुझे बताया जाता है।
I still don't know yet.,मुझे अभी भी नहीं पता।
She gave me a large room while I stayed at her house.,"जब मैं उसके घर पर रही, उसने मुझे रहने के लिए एक बड़ा सा कमरा दिया।"
Every house had a garden.,हर घर में बगीचा था।
Can I help you?,क्या मैं आपकी सहायता कर सकता हूँ?
I'm a good-for-nothing bum.,मैं निकम्मा हूँ।
He made many costly purchases.,उसने बहुत सी महंगी चीज़ें खरीदीं।
That's because you're a girl.,इसलिए क्योंकि तुम लड़की हो।
How many times a day does that bus run?,वह बस दिन में कितनी बार चलती है?
Tom couldn't help but cry.,टॉम खुद को रोने से रोक न सका।
Let me try it.,मुझे ट्राए करने दो।
I don't know what they know.,मुझे नहीं पता कि उन्हें क्या पता है।
I accompanied her on a walk.,मैं उसके साथ सैर के लिए गया।
He is a sharp-shooter.,उसका निशाना बहुत अच्छा है।
I need the following items.,मुझे इन सभी चीजों की जरूरत है।
Cut the potatoes.,आलूओं को काटो।
It's an answer to her letter.,यह उसकी चिट्ठी का जवाब है।
What time is it?,अभी कितने बजे हैं?
I'm hungry!,मुझे भूख लगी है।
"It's windy, isn't it?","यहाँ हवा चल रही है, है ना?"
How are you?,तुम कैसे हो?
That's a good question.,यह एक बहुत अच्छा सवाल है।
Don't lose your temper.,नाराज़ मत हो जाओ।
He was covered in mud from head to foot.,वह सर से पांव तक कीचड़ में लतपत था।
Do you like this color?,यह रंग पसंद है क्या?
I don't agree with you.,मैं तुमसे सहमत नहीं हूँ।
Today is my sister's birthday.,आज मेरी दीदी का जन्मदिन है।
Tom can't drive a bus.,टॉम बस नहीं चला सकता।
He speaks Arabic.,वह अरबी बोलता है।
My hens laid fewer eggs last year.,मेरी मुर्गियों ने पिछले साल के मुकाबले से कम अंडे दियें हैं।
Stars cannot be seen in the daytime.,सितारे दिन में नहीं दिखते |
The baby woke up in the middle of the night.,बच्चा की नींद आधी रात में खुल गई।
When did you get married?,तुम्हारी शादी कब हुई थी?
I believe you like your job.,मुझे लगता है कि तुम्हें तुम्हारा काम अच्छा लगता है।
Everyone likes him.,उसे सब पसंद करते हैं।
Do you believe in God?,क्या तुम भगवान में विश्वास करते हो?
Time goes by quickly.,समय तेज़ी से बीतता है।
How rude of you!,कितने बदतमीज़ हो तुम!
I watch television.,मैं टीवी देखता हूँ।
She didn't want to speak to anyone.,उसे किसी से भी बात करने का मन नहीं था।
I feel sad when I think about all the people who die in wars.,मुझे दुख होता है जब मैं उन लोगों की सोचता हों जो जंग में अपनी जान खो देते हैं।
He came to see me.,वह मुझसे मिलने आया था।
Can you play any musical instruments?,क्या आप कोई वाद्य यंत्र बजाते हैं?
I'm a doctor.,मैं डॉक्टर हूँ।
I'll see you later.,बाद में मिलेंगे।
You shouldn't be outside.,आपको बाहर नहीं होना चाहिए।
The bird on the roof is a crow.,छत पर जो चिड़िया बैठी है वह एक कौआ है।
I usually get home by six o'clock.,मैं आमतौर पर छः बजे तक घर आ जाता हूँ।
The clock has just struck three.,घड़ी पर अभी अभी तीन बजे हैं।
"Excuse me, is there a toilet nearby?","सुनिए, आस-पास में कोई टॉयलेट है क्या?"
Stamps aren't sold in this store.,यहां डाक टिकटें नहीं बेची जातीं हैं।
He could not sleep because of the heat.,वह गर्मी की वजह से सो नहीं पाया।
Tom is standing on the other side of the wall.,टॉम दीवार के दूसरी तरफ खड़ा है।
Do you have brothers and sisters?,तुम्हारे पास भाई-बहन हैं क्या?
Where are you going?,आप कहाँ जा रहे हैं?
"I'm sorry, but I can't hear you well.","माफ़ कीजिएगा, पर मैं आपको ठीक से सुन नहीं पा रही हूँ।"
The doctor advised him not to smoke.,डॉक्टर ने उन्हें सिगरेट न पीने की सलह दी।
A fox is a wild animal.,लोमड़ी जंगली जानवर होती है।
I was able to win the first prize.,मैंने प्रथम पुरस्कार जीत लिया।
I can't move.,मैं हिल नहीं सकता।
He was more than a king.,वह एक राजा से बहुत ज़्यादा था।
I'll give you an answer in a day or two.,मैं तुम्हें एक-दो दिन में जवाब दूँगा।
Such a thing occurs frequently.,ऐसा अक्सर होता है।
A gentleman would not spit on the street.,कोई भी सुशील इनसान सड़क पर थूकेगा नहीं।
I get up at six every day.,मैं रोज़ छः बजे उठता हूँ।
She tried in vain to please him.,उसने बेकार में उसको खुश करने की कोशिश की।
Cross off the names of the people who have paid their dues.,"जो पैसे भर चुकें हैं, उनके नाम काट दो।"
He asked me for some money.,उसने मुझसे थोड़े पैसे माँगे।
You must get rid of such a habit.,तुम्हें इस तरह की आदत तोड़ देनी चाहिए।
We drink our tea with sugar.,हम चाय चीनी के साथ लेते हैं।
Would you mind turning down the volume?,आवाज़ थोड़ी धीमी कर सकते हो क्या?
Is your father a teacher?,क्या तुम्हारे पिताजी टीचर हैं?
I found the glass empty.,मुझे गिलास खाली मिला।
I have a bone to pick with you.,मैं तुमसे खुश नहीं हूँ।
She lived a long life.,उसने लम्बी ज़िन्दगी जी।
It isn't raining much this year.,इस साल ज़्यादा बारिश नहीं हो रही है।
I know those women.,मैं उन औरतों को जानता हूँ।
Why are you talking to me?,मुझसे बात क्यों कर रहे हो?
Sometimes she tried talking to him about India.,वह कभी-कभी उससे भारत की बात करने की कोशिश किया करती थी।
He robbed me of my bag.,उसने मेरा बस्ता चुरा लिया।
She was brought up by her grandmother.,उसकी नानी ने उसे पाल-पोस कर बड़ा किया था।
My father is very nice.,मेरे पिता बहुत अच्छे हैं।
"Maybe I'm unhappy, but I don't intend to kill myself.","हाँ शायद मैं दुखी हूँ, पर मुझे अपनी जान लेने का इरादा नहीं है।"
She is a beauty.,वह तो हसीना है।
Tom has a strange way of talking.,टॉम का बात करने का तरीका अजीब है ।
Did the police arrest Tom?,पुलीस ने टॉम को गिरफ़्तार किया क्या?
The conference will end tomorrow.,सम्मेलन कल समाप्त होगा।
What was the weather like yesterday?,कल का मौसम कैसा था?
They are in favor of the reform of the tax laws.,वे टैक्स सुधार क़ानून के पक्ष में हैं।
I'll be there at five p.m.,मैं वहाँ शाम के पाँच बजे पहुँच जाऊँगा।
You should take care of your sick mother.,तुम्हें अपनी बीमार माँ का ख़याल रखना चाहिए।
I would like to meet his father.,मैं उसके पिता से मिलना चाह्ता हूँ।
I do not know for certain what she is going to do.,मुझे ठीक से नहीं पता वह क्या करने वाली है।
Make it quick.,जल्दी कीजिए।
He has a hat on.,उसने टोपी पहनी हुई है।
Come in.,अंदर आ जाओ।
The water is not drinkable.,यह पानी पिया नहीं जा सकता है।
I can't really talk about it.,मैं उस बारे में कुछ बोल नहीं सकता।
I fear so.,"खेद की बात है, लेकिन वैसा ही है।"
I like the blue one. How much does it cost?,"मुझे नीली वाली पसंद है, कितने की है?"
My family loved Tom.,मेरे परिवार को टॉम पसंद था।
Can you come to the party?,तुम पार्टी में आ सकते हो क्या?
It's your turn. Please come this way.,तुम्हारी बारी है। इस तरफ़ आओ।
Have you ever been to Africa?,आप कभी अफ़्रीका गए हुए हैं क्या?
What would the world do without tea?,दुनिया चाय के बिना क्या करेगी?
Did you sleep well?,तुम अच्छे से सोये क्या?
Where is the south terminal?,दक्षिण टर्मिनल कहाँ पर है?
There are more clouds today than yesterday.,आज बादल कल से ज़्यादा हैं।
